<?xml version="1.0" ?>
<!DOCTYPE defcomplib SYSTEM "http://sources.redhat.com/sid/component.dtd">

<defcomplib lib="librtc.la" dlsym="rtc_component_library">
  <defcomponent name="hw-rtc-sid" type="concrete">

    <defbus name="registers" addresses="0x0..0x7" accesses="read" behaviors="timing"/>

    <defattribute name="hour" category="register" legalvalues="0..23" behaviors="more timing"/>
    <defattribute name="minute" category="register" legalvalues="0..59" behaviors="more timing"/>
    <defattribute name="second" category="register" legalvalues="0..59" behaviors="more timing"/>
    <defattribute name="tk xclock clone" category="gui" legalvalues='"hw-visual-clock"' behaviors="component gui"/>

  </defcomponent>
  <synop>This component is a fictional simplified high-precision real time clock.
  </synop>
  <func>
    <modelling>This component is similar to high-precision dedicated counters
      present as performance tuning aids in some microprocessors.  It
      supplies snapshots of the host systems' time to a target application
    </modelling>

    <behavior name="timing">
      Whenever this component's bus is read with a valid address, it
      returns the addressed subset of two words of information.  The
      first word (address 0x0) contains the number of seconds since the
      host system's epoch.  The second word (address 0x4) contains the
      number of nanoseconds within that second.  Both words are supplied
      in big-endian order.
    </behavior>

    <behavior name="more timing">
    As a special bonus, the
      <attribute>hour</attribute>,
      <attribute>minute</attribute>, and
      <attribute>second</attribute>
    attributes contain the appropriate numbers for the current
    moment, in the GMT timezone.</behavior>
    
    
    <convention name="functional" supported="true"/>
    <convention name="triggerpoint" supported="false"/>
    <convention name="state save/restore" supported="false"/>
    <convention name="component gui" supported="true"/>

  </func>
  <env>
    
    <title>Related components</title>
    <ul>
      <li>
	<p>To use this component, map it into 8 bytes of address
	  space, as in the following sample configuration file fragment: </p>
	<code>
	  new hw-rtc-sid rtc
	  connect-bus mapper [0x1000,0x1007] rtc registers</code></li>
      
      <li>
	<p>
	  The "hw-visual-clock" component is a candidate gui for this
	  component.</p>
	
	<code>
	  new hw-rtc-sid rtc
	  new hw-visual-clock rtc-gui
	  relate rtc-gui "your rtc friend" rtc</code></li></ul>
    
    <title>Host system</title>
    <p>The component relies on the accuracy and precision of UTC time
      maintained by the host.</p>
  </env>
</defcomplib>

  
 


